{
  "$schema": "./observed-baseline.schema.json",
  "schema_version": "ai-bim-observed-baseline/v1",
  "approved_on": "2026-07-30",
  "approved_by": "introduce-executable-architecture-contracts Phase 2",
  "method": "Generated by scripts/dev/export_observed_architecture.py from the committed source tree at the time of approval. Entries recorded here are grandfathered: the ratchet permits them and fails closed on anything new. Removing an entry is always allowed and is the intended direction of travel.",
  "service_edges": [
    {
      "from": "bim-review-coordinator",
      "to": "bim-streaming-server",
      "status": "declared",
      "note": "Permitted by architecture-contract.json may_call (internal-conversion-request, internal-runtime-status, audited-stage-control-intent)."
    },
    {
      "from": "bim-review-coordinator",
      "to": "governance-service",
      "status": "declared",
      "note": "Permitted by architecture-contract.json may_call (coordinator-governance-proxy)."
    },
    {
      "from": "bim-review-coordinator",
      "to": "kit-manager-api",
      "status": "declared",
      "note": "Permitted by architecture-contract.json may_call (audited-runtime-lifecycle-intent)."
    },
    {
      "from": "kit-manager-api",
      "to": "bim-streaming-server",
      "status": "declared",
      "note": "Permitted by architecture-contract.json may_call (kit-fleet-operations, runtime-telemetry)."
    },
    {
      "from": "kit-manager-web",
      "to": "bim-review-coordinator",
      "status": "undeclared-node",
      "debt": {
        "owner": "introduce-executable-architecture-contracts",
        "reason": "apps/kit-manager-web is a second browser client that reaches the coordinator public API, but architecture-contract.json declares only web-viewer-sample as a browser node. The edge itself respects ARCH-HTTP-001 because it targets coordinator:8004; the gap is the missing service declaration, not a boundary violation. Declaring the node changes desired architecture and therefore needs its own delta rather than being smuggled in with the ratchet.",
        "target_phase": "phase-3"
      }
    },
    {
      "from": "kit-manager-web",
      "to": "kit-manager-api",
      "status": "undeclared-node",
      "debt": {
        "owner": "introduce-executable-architecture-contracts",
        "reason": "compose.runtime-manager.yml starts kit-manager-web after kit-manager-api. This is a startup ordering dependency for an operator console that is not yet a declared contract node. Recorded as debt alongside the kit-manager-web declaration gap; a browser client reaching an internal service directly would violate ARCH-HTTP-001 and must be resolved, not merely re-baselined, when the node is declared.",
        "target_phase": "phase-3"
      }
    },
    {
      "from": "web-viewer-sample",
      "to": "bim-review-coordinator",
      "status": "declared",
      "note": "Permitted by architecture-contract.json may_call (public-rest, socket-io) and by browser_access_policy http_api_entrypoints."
    }
  ],
  "cycles": [
    {
      "scope": "module-graph:bim-streaming-server",
      "members": [
        "ezplus.bim_review_stream.messaging",
        "ezplus.bim_review_stream.messaging.extension",
        "ezplus.bim_review_stream.messaging.kit_struct_log"
      ],
      "debt": {
        "owner": "bim-streaming-server",
        "reason": "The Kit extension package __init__ re-exports extension and kit_struct_log, which import back from the package. This is the conventional Omniverse extension entry-point shape; breaking it requires reworking the extension surface.",
        "target_phase": "phase-3"
      }
    },
    {
      "scope": "module-graph:governance-service",
      "members": ["diff_engine", "diff_engine.engine"],
      "debt": {
        "owner": "governance-service",
        "reason": "diff_engine/__init__.py re-exports from engine.py while engine.py imports package-level helpers. Untangling requires moving shared helpers into a leaf module.",
        "target_phase": "phase-3"
      }
    },
    {
      "scope": "module-graph:web-viewer-sample",
      "members": ["App.tsx", "StreamOnlyWindow.tsx", "Window.tsx"],
      "debt": {
        "owner": "web-viewer-sample",
        "reason": "App, Window, and StreamOnlyWindow mutually reference each other for routing and stream-only fallback. The a4-console-convergence and migrate-console-to-hifi-design changes own this surface; splitting it here would conflict with them.",
        "target_phase": "phase-3"
      }
    }
  ],
  "cycle_budgets": [
    { "scope": "service-graph", "maximum": 0, "note": "No service-level dependency cycle is permitted." },
    { "scope": "module-graph:bim-review-coordinator", "maximum": 0 },
    { "scope": "module-graph:bim-streaming-server", "maximum": 1 },
    { "scope": "module-graph:governance-service", "maximum": 1 },
    { "scope": "module-graph:kit-manager-api", "maximum": 0 },
    { "scope": "module-graph:kit-manager-web", "maximum": 0 },
    { "scope": "module-graph:web-viewer-sample", "maximum": 1 }
  ]
}
